Edital,Unidade,Título,Vertente,Orientador,Total de Bolsa
2024,FFCLRP e FMRP,O papel do Serviço de Pesquisa Bibliográfica da Biblioteca Central do Campus USP de Ribeirão Preto e os impactos na produção científica,Pesquisa,Ieda Pelógia Martins Damian,1
2024,FFLCH,Análise dos efeitos da reforma do ensino médio sobre o ensino de geografia: um estudo com docentes da rede estadual de educação de São Pau,Pesquisa,Eduardo Donizeti Girotto,1
2024,FFLCH,Música doméstica ao vivo na cidade de São Paulo na primeira metade do século,Pesquisa,José Geraldo Vinci de Moraes,1
2024,FFLCH,1. Internacionalização e ensino de línguas: aspectos plurilíngues e pluriculturais para a promoção de ações de internacionalização em casa na FFLCH,Pesquisa,Heloisa Brito de Albuquerque Costa,1
2024,FFLCH,"90 ANOS DA FFLCH DA USP: DIFUSÃO E COMUNICAÇÃO INSTITUCIONAL SOBRE SUAS NOVE
DÉCADAS DE HISTÓRIA E MEMÓRIA",Cultura e Extensão,Ana Paula Torres Megiani,3
2024,FFLCH,A categoria de ESPAÇO na língua portuguesa em textos dos séculos XIII a XX/XXI: levantamento de dados por eixos espaciais   Fase I,Pesquisa,Verena Kewitz,1
2024,FFLCH,"A construção da italianidade em São Paulo: discurso, memória, história e identidade",Cultura e Extensão,Elisabetta Antonietta Rita Maria Carmela Santoro,2
2024,FFLCH,A Filologia através da prática: seleção e edição de documentos manuscritos brasileiros e reflexão sobre sua relevância,Ensino,Verena Kewitz,2
2024,FFLCH,A filosofia e seu ensino,Ensino,Eduardo Brandão,2
2024,FFLCH,A Filosofia nos Diálogos Platônicos,Pesquisa,Roberto Bolzani Filho,1
2024,FFLCH,A financeirização do território brasileiro: as fintechs e os bancos digitais,Pesquisa,Fabio Betioli Contel,1
2024,FFLCH,A formação de tutores para o Letramento Acadêmico: o papel do Laboratório de Letramento Acadêmico na formação de graduandos,Ensino,Eliane Gouvêa Lousada,2
2024,FFLCH,A formação em licenciatura no Laboratório de Ensino de Filosofia,Ensino,Marcus Sacrini Ayres Ferraz,2
2024,FFLCH,A Guerra de Sessenta Anos (1810-1870): a região-mundo platina e as causas do conflito de 1864 contra o Paraguai,Pesquisa,Rodrigo Goyena da Silveira Soares,1
2024,FFLCH,A INFLUÊNCIA DA LÍNGUA KIMBUNDU NA AMÉRICA LATINA: ANÁLISE CULTURAL E ELABORAÇÃO DE MANUAL DE GRAMÁTICA,Pesquisa,Alexander Yao Cobbinah,1
2024,FFLCH,A pedagogia moral da família:  Famílias Fortes  e a categoria  família  na construção de políticas públicas no Brasil contemporâneo,Pesquisa,Marília Barbara Fernandes Garcia Moschkovich,1
2024,FFLCH,A questão da  nacionalidade  e a tradução de literatura de língua alemã.,Pesquisa,Helmut Paul Erich Galle,1
2024,FFLCH,"A territorialização do agronegócio no MATOPIBA e a relação entre capital financeiro, terra e natureza",Pesquisa,Marta Inez Medeiros Marques,1
2024,FFLCH,A tradução de literatura alemã no Brasil: trajetórias e biografias de tradutores e tradutoras,Pesquisa,Magdalena Nowinska,1
2024,FFLCH,A transição do ler e escrever em língua portuguesa do ensino médio para o ensino universitário,Pesquisa,Marilia Mendes Ferreira,1
2024,FFLCH,Acessibilidade aos parques em São Paulo: abordagem da análise espacial,Pesquisa,Alfredo Pereira de Queiroz Filho,1
2024,FFLCH,"Ações culturais e produção de vídeos vinculados a temas africanos, afro-brasileiros e árabes; migração, diversidade e interculturalidade",Cultura e Extensão,Rejane Vecchia da Rocha e Silva,1
2024,FFLCH,"Ações de estruturação da recém-criada Área de Estudos Linguísticos   Intercompreensão, Plurilinguismo e Interculturalidade (DLM/FFLCH)",Ensino,Érica Sarsur Câmara,2
2024,FFLCH,Ações extensionistas na implantação do Centro de Estudos Palestinos (CEPal-FFLCH-USP),Cultura e Extensão,Arlene Elizabeth Clemesha,2
2024,FFLCH,Acompanhamento acadêmico-pedagógico de PCDs e pessoas neurodivergentes matriculadas em Elementos de Linguística I e II.,Inclusão e Pertencimento,Olga Ferreira Coelho Sansone,2
2024,FFLCH,"AFRICANIDADES EM DEBATE: RACISMO, EXCLUSÃO E INCLUSÃO DOS AFRODESCENDENTES (SÉC. XVI-XX)",Inclusão e Pertencimento,Vera Lucia Amaral Ferlini,2
2024,FFLCH,Analisar e elaborar dispositivos didáticos para o ensino do tema transversal da BNCC: multiculturalismo,Pesquisa,Emily Caroline da Silva,1
2024,FFLCH,Análise Computacional de Prontuários Clínicos através de Modelos Linguísticos,Pesquisa,Marcos Fernando Lopes,1
2024,FFLCH,Análise microclimática do manguezal: integração das escalas regional e microclimática.,Pesquisa,Emerson Galvani,1
2024,FFLCH,"ANÁLISE MULTIMODAL DE NOTÍCIAS DE JORNAIS SOBRE O CONFLITO DE NAGORNO-KARABAKH, ENTRE ARMÊNIA E AZERBAIJÃO",Pesquisa,Deize Crespim Pereira,1
2024,FFLCH,Antropologia Online: Produção de conteúdo para difusão e divulgação científica,Cultura e Extensão,Guilherme Moura Fagundes,1
2024,FFLCH,Antroponímia paulista: os nomes de nossos antepassados presentes nos Maços de População - Fase 2: Século XVIII- 1765-1767,Pesquisa,Patricia de Jesus Carvalhinhos,1
2024,FFLCH,Apoio à editoração da revista de estudos germanísticos Pandaemonium Germanicum,Pesquisa,Juliana Ferraci Martone,1
2024,FFLCH,"Apoio à Organização, Catalogação e Divulgação do Arquivo de Fotografias Aéreas (AFA) do Departamento de Geografia da FFLCH-USP",Cultura e Extensão,Fernando Shinji Kawakubo,1
2024,FFLCH,"Apoio à Organização, Catalogação e Divulgação do LabCart e AFA",Cultura e Extensão,Rubia Gomes Morato,1
2024,FFLCH,Apoio à editoração e divulgação da revista de estudos russísticos RUS   Revista de Literatura e Cultura Russa,Cultura e Extensão,Maria de Fátima Bianchi,1
2024,FFLCH,Apoio às iniciativas de Difusão do Conhecimento Científico relativas à Inteligência Artificial,Cultura e Extensão,Veridiana Domingos Cordeiro,1
2024,FFLCH,APRENDENDO CARTOGRAFIA: APOIO NO ENSINO DE INTRODUÇÃO À CARTOGRAFIA E CARTOGRAFIA SISTEMÁTICA,Ensino,Rubia Gomes Morato,2
2024,FFLCH,Argumentação e problemática filosófica,Pesquisa,Marcus Sacrini Ayres Ferraz,1
2024,FFLCH,Arquivos operários na cidade de São Paulo: entre a história dos subalternos e a arquivística,Cultura e Extensão,Jean François Germain Tible,1
2024,FFLCH,"Arquivos, histórias e memórias da Linguística: projeto de revitalização, ampliação e e divulgação digital dos arquivos do CEDOCH-DL-USP",Cultura e Extensão,Olga Ferreira Coelho Sansone,1
2024,FFLCH,AS CONSOANTES CAIPIRAS,Pesquisa,Manoel Mourivaldo Santiago Almeida,1
2024,FFLCH,"ATLAS DOS RÉUS PROCESSADOS PELA INQUISIÇÃO PORTUGUESA: DESLOCAMENTOS E ENRAIZAMENTO TERRITORIAL 
(1591-1821)",Pesquisa,Iris Kantor,1
2024,FFLCH,"Atualização do site e das redes sociais do Centro de Estudos Mesoamericanos, Amazônicos e Andinos (CEMAA/USP)",Cultura e Extensão,Eduardo Natalino dos Santos,1
2024,FFLCH,"Batista Júnior. Sons, ruídos e música na indústria fonográfica no início do século XX",Cultura e Extensão,José Geraldo Vinci de Moraes,1
2024,FFLCH,Bíblia Hebraica Interdisciplinar,Ensino,Suzana Chwarts,1
2024,FFLCH,Biografias de tradutoras e tradutores da literatura brasileira para o inglês.,Pesquisa,Lenita Maria Rimoli Pisetta,1
2024,FFLCH,"Canal Oficial História USP
um portal de divulgação científica e de aproximação entre a universidade e a sociedade",Cultura e Extensão,Daniel Gomes de Carvalho,2
2024,FFLCH,Categorias de violência e a disputa pública por direitos,Pesquisa,Heloisa Buarque de Almeida,1
2024,FFLCH,CELP 70 anos: investigando o acervo de literaturas africanas,Pesquisa,Ubiratã Roberto Bueno de Souza,1
2024,FFLCH,Centro Interdepartamental de Línguas: Intercâmbios virtuais para o desenvolvimento linguístico e intercultural dos estudantes de Letras,Ensino,Monica Ferreira Mayrink O' Kuinghttons,2
2024,FFLCH,Ceticismo Filosófico e Ciência Moderna: o pirronismo como via de investigação,Pesquisa,Sara Albieri,1
2024,FFLCH,"Cinema, Geopolítica e Relações Internacionais (CineGRI) Cineclube",Cultura e Extensão,Rafael Antonio Duarte Villa,3
2024,FFLCH,CoMAprend   Corpus Multilíngue de Aprendizes,Ensino,Rodrigo Garcia Rosa,1
2024,FFLCH,Compreendendo fenômenos de cooperação e conflito na América Latina  para o  Ensino de uma cultura de paz,Ensino,Rafael Antonio Duarte Villa,2
2024,FFLCH,Compreensão de Orações Relativas por Crianças Adquirindo o Português Brasileiro como Língua Materna,Pesquisa,Elaine Bicudo Grolla,1
2024,FFLCH,Conectando realidades por meio da Literatura,Inclusão e Pertencimento,Phablo Roberto Marchis Fachin,2
2024,FFLCH,Consórcio de Informações Sociais (CIS): divulgação de bases de dados e incentivo à pesquisa científica,Pesquisa,Edison Ricardo Emiliano Bertoncelo,1
2024,FFLCH,Contando Mulheres (do curso de Filosofia do DF/FFLCH/USP),Ensino,Silvana de Souza Ramos,1
2024,FFLCH,"Contatos (intra)linguísticos, constituição de centros normativos e reordenação do espaço variacional na América hispânica e no Brasil",Pesquisa,Virginia Sita Farias,1
2024,FFLCH,Corpus Histórico do Projeto História do Português Paulista   edição eletrônica de textos dos séculos XVIII e XIII e divulgação científica,Cultura e Extensão,Jose da Silva Simões,1
2024,FFLCH,Crises de Mortalidade e Álgebra de Mapas no Mediterrâneo Tardomedieval - 3a fase,Pesquisa,Marcelo Candido da Silva,1
2024,FFLCH,"DA COLONIZAÇÃO À INDEPENDÊNCIA: HISTÓRIA, LUTAS E DEMOCRACIA NA ÁFRICA LUSÓFONA",Ensino,Vera Lucia Amaral Ferlini,2
2024,FFLCH,Da universidade à escola: as possibilidades didático-pedagógicas do Laboratório de Ensino e Material Didático do Departamento de Geografia da USP,Pesquisa,Regina Araujo de Almeida,1
2024,FFLCH,Descrição e análise da língua inglesa sob o viés metodológico da Linguística de Corpus e da Gramática de Construção,Pesquisa,Rodrigo Garcia Rosa,1
2024,FFLCH,Desenvolvimento web para difusão de pesquisas e informações sobre os povos ameríndios,Cultura e Extensão,Renato Sztutman,1
2024,FFLCH,"Dialética e relações dialógicas na obra de Mikhail Bakhtin:
analisando enunciados de esferas da atividade humana",Pesquisa,Sheila Vieira de Camargo Grillo,1
2024,FFLCH,Digitalização dos Jornais Chineses publicados em São Paulo e guardados na Igreja Católica Chinesa,Cultura e Extensão,Shu Changsheng,1
2024,FFLCH,"Digitalização dos territórios na América Latina: agentes, processos, alcances e limitações",Pesquisa,Maria Mónica Arroyo,1
2024,FFLCH,"Discursos, sentidos e representações de árabes e africanos em fontes europeias, árabes e africanas",Pesquisa,Paulo Daniel Elias Farah,1
2024,FFLCH,DISTRIBUIÇÃO DAS PRAÇAS E PARQUES E JUSTIÇA AMBIENTAL EM SÃO PAULO,Pesquisa,Rubia Gomes Morato,1
2024,FFLCH,Divulgação das dissertações do Profletras-USP,Cultura e Extensão,Beatriz Daruj Gil,1
2024,FFLCH,Edição e difusão de vídeos sobre povos ameríndios,Ensino,Renato Sztutman,2
2024,FFLCH,Edição eletrônica e anotação morfológica do Corpus Histórico do Projeto História do Português Paulista: mudança linguística no português paulista,Pesquisa,Paulo Ângelo de Araújo Adriano,1
2024,FFLCH,Edição filológica e eletrônica de manuscritos dos séculos XVIII e XIX para o Corpus Histórico do Projeto História do Português Paulista,Pesquisa,Jose da Silva Simões,1
2024,FFLCH,"Elaboração e publicação de obras sobre temáticas africanas, árabes, ações afirmativas, estudos migratórios e/ou interculturalidade",Pesquisa,Rejane Vecchia da Rocha e Silva,1
2024,FFLCH,ENSINAR COM MAPAS: ATLAS DOS RÉUS PROCESSADOS PELA INQUISIÇÃO PORTUGUESA NA AMÉRICA. DESLOCAMENTOS E ENRAIZAMENTO TERRITORIAL,Ensino,Iris Kantor,1
2024,FFLCH,ENSINO DA LÍNGUA ARMÊNIA NAS AULAS DE GRADUAÇÃO,Ensino,Fernando Januario Pimenta,1
2024,FFLCH,Ensino da Literatura Portuguesa séculos XVI-XVIII,Ensino,Adma Fadul Muhana,1
2024,FFLCH,"Ensino de Filosofia, licenciatura e a formação inicial de professor: entre as práticas pedagógicas e a produção de recursos didáticos",Ensino,Alex de Campos Moura,1
2024,FFLCH,"Ensino de língua e cultura japonesa em redes públicas: escolas municipais, estaduais e escolas bilíngues de japonês-português",Cultura e Extensão,Leiko Matsubara Morales,3
2024,FFLCH,Ensino de Pesquisa Quantitativa em História: contabilidade mercantil através do Atlântico,Ensino,Daniel Strum,1
2024,FFLCH,Ensino de português no Centro Interdepartamental de Línguas,Ensino,Rosane de Sa Amado,1
2024,FFLCH,"Enunciação, estrutura e dimensões ontológicas em Graça Infinita",Pesquisa,Roberto Zular,1
2024,FFLCH,Escrevivência biográfica de Conceição Evaristo.,Inclusão e Pertencimento,Maria Célia Pereira Lima Hernandes,1
2024,FFLCH,"Espaço, modernização e populações subalternas na América Latina",Pesquisa,Julio Cesar Suzuki,1
2024,FFLCH,Espiritualidades africanas: práticas religiosas de origem africana no Império Português (séculos XVI-XVIII),Pesquisa,Alexandre Almeida Marcussi,1
2024,FFLCH,Estética e crítica da arte moderna e contemporânea.,Pesquisa,Ricardo Nascimento Fabbrini,1
2024,FFLCH,Estudo da metalinguagem e dos conceitos aplicados ao ambiente de ensino-aprendizagem de língua japonesa como língua estrangeira (LE),Pesquisa,Leiko Matsubara Morales,1
2024,FFLCH,Estudo da neologia do português brasileiro contemporâneo: o processo da composição,Pesquisa,Ieda Maria Alves,1
2024,FFLCH,"Estudo interdisciplinar do Acervo da Venerável Ordem Terceira de São Francisco da Penitência da Cidade de São Paulo: 
Filologia, História e Inovação",Pesquisa,Phablo Roberto Marchis Fachin,1
2024,FFLCH,"Evidência da história, disputas de memória e a construção técnica dos indícios históricos: mapeando o giro forense (c. 1980 - )",Pesquisa,Pedro Telles da Silveira,1
2024,FFLCH,Expansão com Equidade? Origens sociais e destinos educacionais no acesso ao ensino superior no Brasil   Um estudo sobre a Universidade de São Paulo,Pesquisa,Murillo Marschner Alves de Brito,1
2024,FFLCH,"EXPERIÊNCIAS COTIDIANAS NO UNIVERSO ESCOLAR/UNIVERSIDADE NA
FORMAÇÃO DA LICENCIATURA EM GEOGRAFIA",Ensino,Anselmo Alfredo,1
2024,FFLCH,Extensão e Variabilidade Espacial da Vegetação Intraurbana no Estado de São Paulo: estimativas por meio de imagens de satélite Landsat-8 e Sentinel-2,Pesquisa,Fernando Shinji Kawakubo,1
2024,FFLCH,Filosofia e literatura: Benedito Nunes interprete de Heidegger,Pesquisa,Marco Aurélio Werle,1
2024,FFLCH,Fomentando o ingresso e a permanência de estudantes cotistas na USP   O Programa de Acolhimento a Estudantes Cotistas (PAECO) da FFLCH,Cultura e Extensão,Murillo Marschner Alves de Brito,1
2024,FFLCH,Fomentando o ingresso e a permanência de estudantes cotistas na USP   O Programa de Acolhimento a Estudantes Cotistas (PAECO) da FFLCH,Inclusão e Pertencimento,Murillo Marschner Alves de Brito,1
2024,FFLCH,Formar-se professor no contexto da reforma do ensino médio: a profissionalidade docente em geografia na rede estadual de educação de São Paulo,Ensino,Eduardo Donizeti Girotto,2
2024,FFLCH,Francês para Objetivo Específico (FOS) emTurismo: formação metodológica para a concepção de programa de ensino e elaboração de atividades didáticas,Ensino,Heloisa Brito de Albuquerque Costa,1
2024,FFLCH,GEELLE   GRUPO DE ESTUDOS SOBRE EDUCAÇÃO LINGUÍSTICA EM LÍNGUAS ESTRANGEIRAS: PESQUISAS  EM FORMAÇÃO DE DOCENTES DE LÍNGUAS ESTRANGEIRAS/ADICIONAIS,Pesquisa,Daniel de Mello Ferraz,1
2024,FFLCH,Gêneros digitais em propostas didáticas de língua portuguesa nos anos finais do Ensino Fundamental,Ensino,Maria Ines Batista Campos Noel Ribeiro,1
2024,FFLCH,Geografia da oralidade: Uma recuperação da história oral de populações tradicionais na América Latina,Cultura e Extensão,Julio Cesar Suzuki,2
2024,FFLCH,Geografia e cinema na América Latina,Ensino,Julio Cesar Suzuki,2
2024,FFLCH,Hínica grega: uma análise comparativa dos hinos órficos e homéricos,Pesquisa,José Marcos Mariani de Macedo,1
2024,FFLCH,História e ficção colaborativa: práticas de escrita e narrativa coletiva,Cultura e Extensão,Alexandre Almeida Marcussi,1
2024,FFLCH,Idade Média e História Pública: Podcast Estudos Medievais,Cultura e Extensão,Marcelo Candido da Silva,1
2024,FFLCH,Índice geral da legislação sobre o trabalho indígena nas Américas (séculos XVI-XIX)   vertente Pequisa,Pesquisa,Carlos Alberto de Moura Ribeiro Zeron,1
2024,FFLCH,Índice geral da legislação sobre trabalho indígena nas Américas (séculos XVI-XIX)   vertente Extensão,Cultura e Extensão,Carlos Alberto de Moura Ribeiro Zeron,1
2024,FFLCH,Internacionalização na FFLCH-USP: Diversidade e Inclusão (InGloba),Inclusão e Pertencimento,Jean François Germain Tible,2
2024,FFLCH,Jornalismo científico: Produção de conteúdo para difusão e divulgação científica,Cultura e Extensão,Sylvia Maria Caiuby Novaes,2
2024,FFLCH,Kits Didáticos - Uso de Documentos Históricos no Ensino,Ensino,Antonia Terra de Calazans Fernandes,2
2024,FFLCH,Laringe e Linguagem: flexibilidade articulatória e interação com a linguagem,Pesquisa,Beatriz Raposo de Medeiros,1
2024,FFLCH,Laudos de autópsia do Serviço de Verificação e Óbitos como base documental para o estudo da mortalidade na cidade de São Paulo (1950 - 1970) - Parte 2,Pesquisa,Márcia Regina Barros da Silva,1
2024,FFLCH,LEMADI DIGITAL E A FORMAÇÃO DE PROFESSORES,Ensino,Paula Cristiane Strina Juliasz,2
2024,FFLCH,LEMADI DIGITAL: divulgação científica e difusão cultural,Cultura e Extensão,Paula Cristiane Strina Juliasz,2
2024,FFLCH,Lete e Mnemosyne: operações da memória na História,Ensino,Ana Paula Tavares Magalhães Tacconi,1
2024,FFLCH,Lete e Mnemosyne: operações da memória na História,Cultura e Extensão,Ana Paula Tavares Magalhães Tacconi,2
2024,FFLCH,Lete e Mnemosyne: operações da memória na História,Pesquisa,Ana Paula Tavares Magalhães Tacconi,1
2024,FFLCH,Letramentos acadêmico-científicos e os diferentes modos de se fazer ciência (fase 2): objetos de pesquisa e estabelecimento de categorias para análise,Pesquisa,Manoel Luiz Goncalves Correa,1
2024,FFLCH,"Levantamento de manuscritos medievais das Etimologia, de Isidoro de Sevilha",Pesquisa,Maria Cristina Correia Leandro Pereira,1
2024,FFLCH,Levantamento de pesquisas em Estudos Coreanos produzidas no Brasil,Pesquisa,Yun Jung Im Park,1
2024,FFLCH,Literatura de língua alemã em tradução para o português do Brasil. Levantamento de dados e análise,Cultura e Extensão,Magdalena Nowinska,1
2024,FFLCH,LITERATURA E CULTURA ARMÊNIA NA ESCOLA,Cultura e Extensão,Fernando Januario Pimenta,1
2024,FFLCH,LLMs e Produção de Corpora Anotados em Português do Brasil,Ensino,Waldir Beividas,2
2024,FFLCH,Mapeamento de áreas e avaliação do carbono no solo de manguezais impactadas por eventos climáticos extremos,Pesquisa,Hermano Melo Queiroz,1
2024,FFLCH,Material didático para o ensino de partículas modais alemãs no contexto local,Ensino,Marceli Cherchiglia Aquino,1
2024,FFLCH,Matrizes do Republicanismo,Pesquisa,Alberto Ribeiro Gonçalves de Barros,1
2024,FFLCH,Memória Estudantil na USP: conservação preventiva e catalogação de fundos documentais do  Projeto Memória  do CAPH (DH-FFLCH),Pesquisa,Everaldo de Oliveira Andrade,1
2024,FFLCH,Memória operária e sindical: a Fábrica São Martinho em Tatuí (SP),Pesquisa,Simone Scifoni,1
2024,FFLCH,"Memória Toponímica de São Paulo e de outros espaços: divulgando as ciências onomásticas - podcast NomeAr,  O Nome está no Ar",Cultura e Extensão,Patricia de Jesus Carvalhinhos,1
2024,FFLCH,Monitoria audiovisual no Laboratório de Imagem e Som em Antropologia.,Ensino,Rose Satiko Gitirana Hikiji,2
2024,FFLCH,Movimentos de Massa no Município de São Sebastião (SP): Avaliação de Suscetibilidade e de Perigo,Pesquisa,Bianca Carvalho Vieira,1
2024,FFLCH,"Mulheres na Geomorfologia: Produção Acadêmica, Representatividade Científica no Contexto Nacional",Cultura e Extensão,Bianca Carvalho Vieira,1
2024,FFLCH,O acervo fílmico do LISA: legendagem e acessibilidade,Inclusão e Pertencimento,Guilherme Moura Fagundes,2
2024,FFLCH,O contato do português com línguas indígenas na cidade de São Paulo: uma primeira aproximação,Pesquisa,Evani de Carvalho Viotti,1
2024,FFLCH,O Córpus Carolina  no Centro de Inteligência Artificial da USP: Identificação de variedades linguísticas,Pesquisa,Maria Clara Paixao de Sousa,1
2024,FFLCH,O Córpus Carolina no Centro de Inteligência Artificial da USP: o domínio do texto jornalístico,Pesquisa,Vanessa Martins do Monte,1
2024,FFLCH,O desvozeamento variável de vogais finais átonas no português paulistano,Pesquisa,Ronald Beline Mendes,1
2024,FFLCH,O estudo do ato de fala pedido no par linguístico português e alemão: uma análise na perspectiva cross-cultural da linguagem em uso,Cultura e Extensão,Marceli Cherchiglia Aquino,1
2024,FFLCH,"O futuro do passado ameríndio: objetos, espaços sociais e histórias indígenas na América do Sul contemporânea (1970-2024)",Pesquisa,Guilherme Bianchi Moreira,1
2024,FFLCH,O mal e o seu remédio: transcrição das cartas manuscritas de Duarte Ribeiro de Macedo,Pesquisa,Pedro Luis Puntoni,1
2024,FFLCH,O Mundo dos Engenhos na Sociedade Colonial (século XVI e XIX),Pesquisa,Rodrigo Monteferrante Ricupero,1
2024,FFLCH,"O papel das agências de notícias televisivas norte-americanas na política brasileira 
(1959   1974)",Pesquisa,Marcos Francisco Napolitano de Eugênio,1
2024,FFLCH,O poema Nirvana de Paulino Dias (1874-1919) - projeto de iniciação científica,Pesquisa,Helder Garmes,1
2024,FFLCH,O político no econômico: qual o papel atribuído a políticas governamentais nas recentes crises que acometeram o Brasil?,Pesquisa,André Vereta Nahoum,1
2024,FFLCH,O repertório imagético presente nos materiais didáticos do ensino fundamental e a construção de uma educação quilombola.,Ensino,Fernanda Padovesi Fonseca,2
2024,FFLCH,O Tribunal Eleitoral Superior nos anos 1930: sistematização de dados,Pesquisa,Paolo Ricci,1
2024,FFLCH,Observatório Eleitoral da OEA: a formação de observadores eleitorais e o aperfeiçoamento das democracias,Ensino,Janina Onuki,2
2024,FFLCH,Ocupação Intelectual Preta: aquilombando a memória negra em histórias vivas,Inclusão e Pertencimento,Julio Cesar Pimentel Pinto Filho,2
2024,FFLCH,"Oeste paulista modernização e contradição campo cidade
Três momentos críticos: 1950, 1970 e 2008",Pesquisa,Anselmo Alfredo,1
2024,FFLCH,Oficinas de Práticas Agroecológicas,Cultura e Extensão,Carlos de Almeida Toledo,1
2024,FFLCH,OFICINAS ITINERANTES  DA ITÁLIA PARA O BRASIL,Cultura e Extensão,Fernanda Landucci Ortale,1
2024,FFLCH,Oportunidades profissionais e ciências sociais: um projeto para difusão de oportunidades profissionais e conexão com egressos.,Cultura e Extensão,Manoel Galdino Pereira Neto,1
2024,FFLCH,Organização e Administração dos livros da área de Estudos Coreanos para ensino e pesquisa,Ensino,Ji Yun Kim,1
2024,FFLCH,"Organização, limpeza e catalogação do acervo privado da Profa. Dra. Zilda Márcia Gricoli Iokoi",Pesquisa,Mauricio Cardoso,1
2024,FFLCH,OS LIMITES DA TEORIA CRÍTICA EM QUESTÃO,Pesquisa,Virginia Helena Ferreira da Costa,1
2024,FFLCH,Paremiologia armênia: estudo de provérbios armênios,Pesquisa,Fernando Januario Pimenta,1
2024,FFLCH,Passaporte Universitário,Cultura e Extensão,Janina Onuki,1
2024,FFLCH,Patrimônio Cultural e Inovação: documentos em papel e sociedade,Cultura e Extensão,Phablo Roberto Marchis Fachin,1
2024,FFLCH,PENSAMENTO E IDEIAS POLÍTICAS NA OBRA ORATIO SUPPLICATORIA DE MERCURINO DE GATTINARA (1516),Pesquisa,Ana Paula Torres Megiani,1
2024,FFLCH,PERFORMATIVIDADE DE GÊNERO: ENTRE A TEORIA E A EMPIRIA,Inclusão e Pertencimento,Virginia Helena Ferreira da Costa,1
2024,FFLCH,Periferias na Pandemia III: gestão de dados em plataforma interativa  de (in)segurança humana  no COVID-19 no Brasil   e América Latina.,Pesquisa,Rafael Antonio Duarte Villa,1
2024,FFLCH,Perspectivas de pesquisa em História Atlântica com base em fontes notariais,Pesquisa,Daniel Strum,1
2024,FFLCH,Pesquisa de Iniciação Científica em Literatura Portuguesa (séculos XVI-XVIII),Pesquisa,Adma Fadul Muhana,1
2024,FFLCH,Pesquisa Documental sobre a produção de conhecimento dos Movimentos de Familiares de vítimas da letalidade policial,Pesquisa,Veridiana Domingos Cordeiro,1
2024,FFLCH,Pesquisa histórica e inteligência artificial: aprendizado de máquina e trabalho coletivo,Cultura e Extensão,Daniel Strum,1
2024,FFLCH,Plataforma Digital do Observatório Espaço-Temporal do  Novo  Museu Paulista-USP,Pesquisa,Fraya Frehse,1
2024,FFLCH,Plurilinguismo e diversidade cultural: heranças culturais na obra musical de Consuelo de Paula,Pesquisa,Érica Sarsur Câmara,1
2024,FFLCH,"Plurilinguismo, interculturalidade: a pluralidade linguístico e cultural nos Centros de Línguas",Cultura e Extensão,Eliane Gouvêa Lousada,1
2024,FFLCH,Poesia e narrativa: análise e interpretação de autores brasileiros modernos,Pesquisa,Ariovaldo José Vidal,1
2024,FFLCH,Por uma educação inclusiva: a extroversão do acervo e das atividades do Laboratório de Ensino e Material Didático do Departamento de Geografia,Cultura e Extensão,Regina Araujo de Almeida,1
2024,FFLCH,PORTUGAL: DA DITADURA À DEMOCRACIA (1928-1974)   Fase II,Pesquisa,Vera Lucia Amaral Ferlini,1
2024,FFLCH,"Pragmática cross-cultural: questionários para estudar o ato de fala do pedido em português, italiano, espanhol e outras línguas românicas",Pesquisa,Adriana Mendes Porcellato,1
2024,FFLCH,"Pragmática cross-cultural: role plays para investigar o ato de fala do pedido em português, italiano, espanhol e outras línguas românicas",Pesquisa,Elisabetta Antonietta Rita Maria Carmela Santoro,1
