Edital,Unidade,Título,Vertente,Orientador,Total de Bolsa
2024,EP,Censo politécnico sobre bem-estar e saúde mental: um recorte do Departamento de Engenharia Mecânica,Inclusão e Pertencimento,Marlon Sproesser Mathias,1
2024,EP,Censo politécnico sobre bem-estar e saúde mental: um recorte do departamento de Engenharia Mecatrônica e de Sistemas Mecânicos,Inclusão e Pertencimento,Celso Massatoshi Furukawa,2
2024,EP,Censo politécnico sobre bem-estar e saúde mental: um recorte do departamento PSI,Inclusão e Pertencimento,Bruno Cavalcante de Souza Sanches,2
2024,EP,Ciência de Dados aplicada ao InovaLab@POLI-Elétrica,Ensino,Fernando Josepetti Fonseca,2
2024,EP,COMPARAÇÃO DA QUALIDADE DOS SISTEMAS GNSS UTILIZANDO FERRAMENTAS DE PROCESSAMENTO OFFLINE E ONLINE,Pesquisa,Edvaldo Simões da Fonseca Junior,1
2024,EP,Comparação de Horas de Aula e Grades Curriculares entre Cursos de Engenharia Civil do Exterior e do Brasil,Ensino,Augusto Camara Neiva,1
2024,EP,"Concepção e preparação de palestras sobre a carreira de Engenharia Elétrica para alunos do
Ensino Médio",Cultura e Extensão,Giovanni Manassero Junior,1
2024,EP,Criação de Material de Apoio às Disciplinas PEF3307 e PMR-3320,Ensino,Ronaldo Carrion,1
2024,EP,Criação de Material Didático de Proteção e Automação de Sistemas Elétricos Utilizando Simulador Digital de Tempo Real,Ensino,Giovanni Manassero Junior,1
2024,EP,Criação de modelos 3D utilizando ferramentas computacionais para apoio da disciplina de Métodos de Lavra Subterrânea,Ensino,Anna Luiza Marques Ayres da Silva,1
2024,EP,DESEMPENHO FUNCIONAL E AMBIENTAL DA FASE DE USO DE PAVIMENTOS RODOVIÁRIOS,Pesquisa,Kamilla Vasconcelos Savasini,1
2024,EP,Desenvolvimento de Ferramentas para Automatização de Exercícios Práticos em Disciplinas de Sistemas Operacionais,Ensino,Artur Jordão Lima Correia,1
2024,EP,Desenvolvimento de hardware de baixo custo para aquisição e compressão de sinais em FPGA/ASICs para aplicações em física,Pesquisa,Bruno Cavalcante de Souza Sanches,1
2024,EP,Desenvolvimento de Materiais Cerâmicos Utilizando Resíduos da Construção Civil,Pesquisa,Andre Luiz da Silva,1
2024,EP,Desenvolvimento de Novos Materiais Didáticos para as disciplinas Engenharia de Energia Hidroletrica e Engenharia de Energia Solar Fotovoltica,Ensino,Jose Aquiles Baesso Grimoni,1
2024,EP,Desenvolvimento de produtos e protótipos por alunos de graduação no INOVALAB@POLI,Ensino,Davi Noboru Nakano,2
2024,EP,Desenvolvimento de Robô paralelo com sistema de acionamento por cabos,Ensino,Tarcisio Antonio Hess Coelho,2
2024,EP,Desenvolvimento de simuladores para treinamento de procedimentos de profissionais da área da saúde com Realidade Virtual,Pesquisa,Ricardo Nakamura,1
2024,EP,DESENVOLVIMENTO DE SINGLE BOARD COMPUTER ABERTA PARA IoT,Cultura e Extensão,Marcelo Knorich Zuffo,1
2024,EP,Desenvolvimento de sistema eletroeletrônico para automação de farmácia hospitalar,Pesquisa,João Francisco Justo Filho,1
2024,EP,Desenvolvimento e aplicação da IA generativa na Educação em nível superior,Ensino,Clovis Armando Alvarenga Netto,1
2024,EP,DESSALINIZAÇÃO DE ÁGUA SALOBRA OU SALINA POR ENERGIA SOLAR,Pesquisa,José Roberto Simões Moreira,1
2024,EP,Detecção de Falhas em Turbinas Eólicas Utilizando Técnicas de Inteligência Artificial Supervisionadas e Não Supervisionadas,Pesquisa,Arthur Henrique de Andrade Melani,1
2024,EP,DETERMINAÇÃO DAS PROPRIEDADES GEOTÉCNICAS DE REJEITO DE MINERAÇÃO DE FERRO PARA REUSO EM OBRAS CIVIS,Pesquisa,Maria Eugênia Gimenez Boscov,1
2024,EP,Determinantes do Engajamento Acadêmico no curso de Engenharia de Produção: Um Estudo de Caso na Escola Politécnica,Ensino,Ana Paula Franco Paes Leme Barbosa,1
2024,EP,Diagnóstico da ventilação natural de uma habitação de interesse social frente a necessidades básicas dos moradores,Cultura e Extensão,Fernando Akira Kurokawa,1
2024,EP,Difusão da IA generativa na Educação,Cultura e Extensão,Clovis Armando Alvarenga Netto,1
2024,EP,Digital Twin - Abordagem de Sistemas Híbridos Aplicados à Modelagem de Agroindústria,Pesquisa,Paulo Eigi Miyagi,1
2024,EP,DINÂMICA DE FINANCIAMENTO DE MINERAÇÃO DE PEQUENA ESCALA,Cultura e Extensão,Giorgio Francesco Cesare de Tomi,1
2024,EP,Elaboração de especificações gráficas para material didático voltadas à inclusão e acessibilidade no ensino superior,Inclusão e Pertencimento,Fábio Cunha Lofrano,1
2024,EP,Elaboração de material didático para a utilização de uma ferramenta de CAD na disciplina de representação gráfica do curso de mecatrônica,Ensino,Fernando Akira Kurokawa,1
2024,EP,ENSINO DE GRADUAÇÃO EM ENGENHARIA DE CONSTRUÇÃO CIVIL BASEADO EM APRENDIZAGEM POR PROJETO,Ensino,Luiz Reynaldo de Azevedo Cardoso,1
2024,EP,ENSINO DE REVISÃO SISTEMÁTICA: METODOLOGIA E APLICAÇÃO,Ensino,Ana Carolina Russo,1
2024,EP,Esquemas de redundância e integração com bases de dados em sistemas de automação industrial,Pesquisa,Milana Lima dos Santos,1
2024,EP,Estamos juntos: gamificação inclusiva para superar os desafios do Biênio da Engenharia,Inclusão e Pertencimento,Milana Lima dos Santos,1
2024,EP,ESTRUTURAS NA ARQUITETURA I: PROPOSTA PARA APOIO AOS DOCENTES E À ELABORAÇÃO DE MATERIAL DIDÁTICO,Ensino,Cláudius de Sousa Barbosa,1
2024,EP,Estudo do comportamento estrutural de sistemas de bambu engenheirado laminado,Pesquisa,Leila Cristina Meneghetti Valverdes,1
2024,EP,Estudo do Transistor Forksheet e suas Aplicações,Pesquisa,João Antonio Martino,1
2024,EP,"ESTUDO E SISTEMATIZAÇÃO DE MÉTODOS E MÉTRICAS URBANAS APLICÁVEIS A PLANEJAMENTO DE BAIRROS, APLICÁVEIS AO MUNICÍPIO DE SÃO PAULO",Cultura e Extensão,Karin Regina de Castro Marins,1
2024,EP,Estudo eletroquímico da interação entre a pirita com o aço-carbono em meio contendo coletor xantato,Pesquisa,Jean Vicente Ferrari,1
2024,EP,ESTUDO OPERACIONAL E PRÁTICO PARA A INTEGRAÇÃO DO TRANSPORTE URBANO DE CARGAS NO PLANEJAMENTO EM ÁREAS DE ADENSAMENTO URBANO DE SÃO PAULO,Pesquisa,Karin Regina de Castro Marins,1
2024,EP,Explorando a Engenharia de Materiais na Escola Politécnica: Ações de Divulgação,Cultura e Extensão,Patrícia Schmid Calvão,1
2024,EP,Explorando Metodologias Ativas para Engajamento e Aprendizagem em Ciência e Engenharia de Materiais,Ensino,Patrícia Schmid Calvão,1
2024,EP,Ferramenta de análise da Fibrilação Atrial em eletrocardiogramas: Extração do QRS e cálculo do espectro.,Cultura e Extensão,Renata Valeri de Freitas,1
2024,EP,Ferramentas de simulação: uso em disciplinas de Eletricidade e Automação,Ensino,Milana Lima dos Santos,1
2024,EP,"Fronteiras da Indústria de Papel e Celulose no Brasil, Análise de Viabilidade Econômica de uma Nova Fábrica no Estado da Arte",Pesquisa,Manoel Rodrigues Neves,1
2024,EP,Geotecnologias aplicadas ao planejamento e infraestrutura de transportes,Pesquisa,Diego Bogado Tomasiello,1
2024,EP,"Gestão da Cultura: Contratos de Gestão da Secretaria de Cultura, Economia e Indústrias Criativas do Estado de São Paulo",Pesquisa,Davi Noboru Nakano,1
2024,EP,Identificação de relações causais entre o conteúdo conceitual das provas e as notas dos alunos,Pesquisa,Flavius Portella Ribas Martins,1
2024,EP,Identificaçãoo de Períodos Críticos na Regularização de Redes Neurais,Pesquisa,Artur Jordão Lima Correia,1
2024,EP,Ignição Assistida por Plasma para Aplicação em Motores de Combustão Interna,Pesquisa,Ronaldo Domingues Mansano,1
2024,EP,Iluminação na mineração subterrânea,Pesquisa,Anna Luiza Marques Ayres da Silva,1
2024,EP,Impacto de alagamentos na operação de transporte público por ônibus,Pesquisa,Cassiano Augusto Isler,1
2024,EP,Implementação de estratégias de aprendizagem ativa para disciplinas de planejamento e operação de transportes da Escola Politécnica,Ensino,Mateus Humberto Andrade,1
2024,EP,Implementação do número de Womersley na ferramenta OpenFOAM para modelagem hemodinâmica de vasos sanguíneos,Pesquisa,Fernando Akira Kurokawa,1
2024,EP,Influência de vazios entre camadas no desempenho mecânico de elementos de concreto produzidos com impressão 3D,Pesquisa,Renata Monte,1
2024,EP,INSTALAÇÃO E USO DE UM BIODIGESTOR ANAERÓBIO NA COMUNIDADE SÃO REMO PARA USO DO BIOGÁS EM UMA COZINHA COMUNITÁRIA COM BASE NA EXP. DESENV. NO IEE-USP,Cultura e Extensão,Ronan Cleber Contrera,2
2024,EP,Interface Tangível para Interação Imersiva via Web,Pesquisa,Romero Tori,1
2024,EP,Investigação experimental e descrição termodinâmica do sistema Mo   Nb   Zr (Molibdênio   Nióbio   Zircônio),Pesquisa,Claudio Geraldo Schön,1
2024,EP,Levantamento das Taxas de Evasão do Curso de Engenharia Mecânica da EPUSP no Período 2020-2024 e Medidas Possíveis para sua Redução,Inclusão e Pertencimento,Roberto Ramos Junior,1
2024,EP,Localização de falhas em linhas de transmissão de interconexões de parques eólicos na rede Básica de Transmissão,Pesquisa,Silvio Giuseppe Di Santo,1
2024,EP,Manual de Gases em Minas Subterrâneas,Cultura e Extensão,Anna Luiza Marques Ayres da Silva,1
2024,EP,Manutenção de uma Plataforma Web de Acesso Remoto ao Laboratório LabDig,Ensino,Bruno de Carvalho Albertini,1
2024,EP,Mecanização de colheita de frutas - Continuação,Pesquisa,Oswaldo Horikawa,1
2024,EP,Métodos Autossupervisionados de Representação do Sinal de Voz baseados em Aprendizagem Profunda,Pesquisa,Miguel Arjona Ramirez,1
2024,EP,Mineração Responsável: Avaliação da Eficácia dos Sistemas Anticolisão em Operações a Céu Aberto,Pesquisa,Giorgio Francesco Cesare de Tomi,1
2024,EP,Modelagem de componentes no contexto do conjunto na disciplina PCC3100 Representação Gráfica para Projeto,Ensino,Joao Roberto Diego Petreche,1
2024,EP,Modelagem de Transistores BE SOI MOSFET,Cultura e Extensão,João Antonio Martino,1
2024,EP,Modelos de negócios circulares com inclusão social nos setores têxtil e eletroeletrônico,Pesquisa,Roberta de Castro Souza Piao,1
2024,EP,Nanoengenharia Assistida por Computador,Ensino,Daniela Andrade Damasceno,1
2024,EP,O PROCESSO DE TOMADA DE DECISÃO EM SISTEMAS ESTRATÉGICOS,Pesquisa,Elsa Vásquez Alvarez,1
2024,EP,O USO DO MYOSCILLOSCOPE EM DISCIPLINAS DA ENGENHARIA ELÉTRICA: APRIMORAMENTOS DE HARDWARE E SOFTWARE,Ensino,Elisabete Galeazzo,1
2024,EP,Obtenção de um Guia Técnico para Análise e Classificação de Poços Descomissionados para Serem Usados em Captura e Armazenamento de Carbono,Cultura e Extensão,Nara Angélica Policarpo,1
2024,EP,Oportunidades para a Aplicação de Hidrogênio Verde como Vetor para o Armazenamento de Energia no Contexto Brasileiro,Pesquisa,Juan Carlos Cebrian Amasifen,1
2024,EP,Panorama de produção científica tecnológica no programa de pós-doutorado na Poli-USP (2021 a 2024).,Cultura e Extensão,Jean Vicente Ferrari,1
2024,EP,PCSOL - Programa de cálculos solarimétricos,Ensino,José Roberto Simões Moreira,1
2024,EP,Pesquisa exploratória para o desenvolvimento de uma solução tecnológica para descontaminação de mercúrio em rejeitos de ouro da pequena mineração,Cultura e Extensão,Ana Carolina Russo,1
2024,EP,PLANEJAMENTO DE LAVRA PARA TRANSIÇÃO DE MINA A CÉU ABERTO PARA SUBTERRÂNEA COM O USO DO MÉTODO DE BLOCK CAVING,Ensino,Giorgio Francesco Cesare de Tomi,1
2024,EP,Plataforma  Experimental  e  Proposta  de  Experimentos  para  as  novas disciplinas  Eletrônica de Potência 1 e,Ensino,Lourenço Matakas Junior,2
2024,EP,Plataforma Experimental e Proposta de Experimentos para as novas disciplinas Eletrônica de Potência 1 e 2,Ensino,Wilson Komatsu,2
2024,EP,PLATAFORMA PARA AQUISIÇÃO DE SINAIS DE SENSORES EM SMARTPHONES PARA APLICAÇÕES DIDÁTICAS,Ensino,Vitor Heloiz Nascimento,1
2024,EP,Portal  Educação Imersiva,Cultura e Extensão,Romero Tori,2
2024,EP,POTENCIALIZANDO O ENSINO EM ENGENHARIA COM METODOLOGIA DE ENSINO-APRENDIZAGEM ATIVA EM SALA DE AULA,Ensino,Elsa Vásquez Alvarez,1
2024,EP,Produção de curativos feitos de nanocelulose bacteriana provinda de bactérias de Kombucha e Jun,Pesquisa,Guilherme Frederico Bernardo Lenz e Silva,1
2024,EP,Produção de Materiais Didáticos para Uso na Disciplina   Materiais para Aplicações em Energias Limpas e Renováveis,Ensino,Andre Luiz da Silva,1
2024,EP,Produção de vídeos didáticos para subsidiar práticas laboratoriais em engenharia hidráulica,Ensino,Fábio Cunha Lofrano,1
2024,EP,Projeto  POLI para TODOS  | Apresentação da Carreira Engenharia 8a. Edição.,Cultura e Extensão,Antonio Marcos de Aguirra Massola,2
2024,EP,Projeto de Carro Eletrico Solar - 2a fase,Pesquisa,Jose Aquiles Baesso Grimoni,1
2024,EP,Projeto de desenvolvimento de uma ferramenta de censo dos alunos de Engenharia,Inclusão e Pertencimento,Jose Aquiles Baesso Grimoni,2
2024,EP,Projeto POLIS: Ações de Inclusão e Pertencimento para uma Poli Plural,Inclusão e Pertencimento,Cleyton de Carvalho Carneiro,2
2024,EP,PROPOSTA DE CURRICULARIZAÇÃO DA EXTENSÃO: CONSTRUÇÃO DE  MACROMODELOS DE TRÁFEGO - ESTUDO DE CASO NA CIDADE DE SANTO ANDRÉ,Cultura e Extensão,Claudio Luiz Marte,1
2024,EP,Propriedades Dinâmicas de Estruturas Porosas de PLA Produzidas por Impressão 3D (FDM): Influência das Condições de Processamento,Pesquisa,Patrícia Schmid Calvão,1
2024,EP,Propulsor Elétrico Auxiliar para Cadeira de Rodas,Pesquisa,Celso Massatoshi Furukawa,1
2024,EP,REALIDADE VIRTUAL IMERSIVA COMO FERRAMENTA DE INCLUSÃO DIGITAL NO PROJETO DA INFRAESTRUTURA DE TRANSPORTES,Inclusão e Pertencimento,Claudio Luiz Marte,1
2024,EP,Renovando espaços físicos dos restaurantes,Cultura e Extensão,Sérgio Leal Ferreira,1
2024,EP,Revestimentos resistentes ao desgaste processados por sinterização à plasma em substrato de ferro fundido,Pesquisa,Juliane Ribeiro da Cruz Alves,1
2024,EP,Robô bio-inspirado com locomoção de uma cobra,Pesquisa,Tarcisio Antonio Hess Coelho,1
2024,EP,Seleção da posição de cilindros auxiliares visando coleta de energia,Pesquisa,Rafael dos Santos Gioria,1
2024,EP,Seleção de Estratégias de Produção de Petróleo Visando Minimizar a Emissão de CO2,Pesquisa,Marcio Augusto Sampaio Pinto,1
2024,EP,Sincronização de neurônios a partir do modelo de Hindmarsh-Rose com sinapse química,Pesquisa,Marcio Eisencraft,1
2024,EP,Swarm Computing aplicado a Cidades Inteligentes: pesquisa e desenvolvimento de uma rede de vigilância colaborativa para grandes centros urbanos,Pesquisa,Marcelo Knorich Zuffo,1
2024,EP,Temas da Engenharia com Contextualização Histórica,Cultura e Extensão,Ronaldo Carrion,1
2024,EP,TRATAMENTO DE LIXIVIADOS DE ATERROS SANITÁRIOS VISANDO REMOÇÃO E RECUPERAÇÃO DE NITROGÊNIO,Pesquisa,Ronan Cleber Contrera,1
2024,EP,Uma abordagem Dinâmica para o Ensino de Conceitos Básicos de Eletricidade e Automação em Escolas Públicas,Cultura e Extensão,Juan Carlos Cebrian Amasifen,2
2024,EP,USPolis   Sistema para Alocação e Gestão de Salas de Aula,Ensino,Fabio Levy Siqueira,1
2024,EP,Utilização do laboratório Fábrica do Futuro 4.0 em atividades didáticas,Ensino,Eduardo de Senzi Zancul,1
2024,EP,Validação de Novo Protótipo para Automatizar Testes de Heterogeneidade de Minérios,Pesquisa,Ana Carolina Chieregati,1
2024,EP,Validação de uma metodologia integrada e de baixo custo para a avaliação da aplicabilidade de pré-concentração e seus impactos na cominuição,Pesquisa,Maurício Guimarães Bergerman,1
2024,EP,Validação e aplicação da modelagem computacional da interação fluído-sólido por método de partículas,Pesquisa,Cheng Liang Yee,1
2024,EP,Validando um instrumento de coleta de dados para analisar a performance do trabalhador a partir de um modelo sistêmico,Pesquisa,Ana Paula Franco Paes Leme Barbosa,1
2024,EP,Valorização de rejeito da carcinicultura: Preparação e caracterização de derivados da quitina e da quitosana,Pesquisa,Wang Shu Hui,1
2024,ESALQ,A história da ciência da engenharia e a química na mecanização e agricultura.,Pesquisa,Marcos Milan,1
2024,ESALQ,A segurança alimentar de base comunitária para promoção da dignidade menstrual de mulheres periféricas em Piracicaba.,Cultura e Extensão,Odaléia Telles Marcondes Machado Queiroz,1
2024,ESALQ,A variedade de cana-de-açúcar modula a ação dos microrganismos promotores de crescimento?,Pesquisa,Carlos Antonio Costa do Nascimento,1
2024,ESALQ,A violência de gênero e suas influências na carreira: um olhar para mulheres em situação de vulnerabilidade,Pesquisa,Heliani Berlato dos Santos,1
2024,ESALQ,"Ação de Orientação e Comunicação sobre o Programa de Apoio, Permanência e Formação Estudantil - PAPFE 2024/2025",Inclusão e Pertencimento,Maria Carolina Quecine Verdi,1
2024,ESALQ,Ações de Redução de Emissões de Gases do Efeito Estufa para o campus  Luiz de Queiroz /USP/Piracicaba,Pesquisa,Carlos Eduardo Pellegrino Cerri,1
2024,ESALQ,Ações para Articulação da Extensão na ESALQ/USP,Cultura e Extensão,Antonio Carlos de Azevedo,1
2024,ESALQ,"Ações para conviver, pertencer e se sentir seguro no campus  Luiz de Queiroz",Inclusão e Pertencimento,Taciana Villela Savian,1
2024,ESALQ,"Ações preventivas, educativas e de monitoramento do gênero Aedes no campus  Luiz de Queiroz",Cultura e Extensão,Pedro Takao Yamamoto,2
2024,ESALQ,Acolhimento e Pertencimento na ESALQ/USP: Recepção e Ações contínuas para Integração,Inclusão e Pertencimento,Thiago Liborio Romanelli,1
2024,ESALQ,Adição de resíduos orgânicos e fitorremediação de bário em solos alagados,Pesquisa,Jussara Borges Regitano,1
2024,ESALQ,ANÁLISE  BIBLIOMÉTRICA SOBRE AS DIFERENTES METODOLOGIAS CERTIFICADORAS DE CRÉDITO DE CARBONO,Pesquisa,Patricia Angélica Alves Marques,1
2024,ESALQ,"Análise comportamental de ovinos: integração entre sensor de aceleração, análise de imagem e inteligência artificial",Pesquisa,Késia Oliveira da Silva Miranda,1
2024,ESALQ,Análise da Decomposição da Fitomassa em Plantas de Cobertura e Liberação de Nitrogênio em Plantio Direto,Pesquisa,Giovana Ghisleni Ribas,1
2024,ESALQ,Análise da interação da abelha Jataí com a vegetação - desenvolvimento de um calendário floral para o planejamento de pasto melípona,Pesquisa,Ciro Abbud Righi,1
2024,ESALQ,Análise da Viabilidade do Tratamento dos Resíduos Sólidos Orgânicos do Restaurante Universitário do Campus  Luiz de Queiroz,Pesquisa,Carlos Eduardo de Freitas Vian,1
2024,ESALQ,Análise da viabilidade econômica e financeira para implantação e operação de um centro equoterápico no município de Piracicaba-SP,Pesquisa,Roberto Arruda de Souza Lima,1
2024,ESALQ,Análise das políticas de segurança alimentar em Municípios da Região Metropolitana de Piracicaba: Do diagnóstico aos indicadores de resultados,Pesquisa,Silvia Helena Galvao de Miranda,1
2024,ESALQ,Análise das variações do tamanho de partícula da dieta de bovinos em confinamento: Impacto da Raça e do Nível de Fibra,Pesquisa,Dante Pazzanese Duarte Lanna,1
2024,ESALQ,Análise de crescimento de cultivares de trigo tropical semeado na safra e segunda safra agrícola,Pesquisa,Jose Laercio Favarin,1
2024,ESALQ,Análise de crescimento de duas espécies de amendoim forrageiro em resposta a diferentes intensidades de desfolhação,Pesquisa,Carlos Guilherme Silveira Pedreira,1
2024,ESALQ,Análise de Indicadores e Práticas ESG no Agronegócio Brasileiro: Um Panorama sobre Sustentabilidade Ambiental,Pesquisa,Maria Paula Vieira Cicogna Abreu,1
2024,ESALQ,Análise do desempenho de novas tecnologias que podem otimizar a fertilização mineral em plantações florestais,Pesquisa,Luciana Duque Silva,1
2024,ESALQ,ANÁLISE ECONÔMICA E AMBIENTAL DE LAVOURAS DE SOJA NO BRASIL,Cultura e Extensão,Giovana Ghisleni Ribas,1
2024,ESALQ,Análise estatística aplicada à dinâmica de insetos florestais,Pesquisa,Marcelo Andrade da Silva,1
2024,ESALQ,Análise exploratória sobre o emprego dos profissionais de nível técnico no agronegócio brasileiro,Pesquisa,Nicole Renno Castro,1
2024,ESALQ,Análise histopatológica da interação Rubus idaeus cv. Heritage-Aculeastrum americanum sob duas temperaturas,Pesquisa,Beatriz Appezzato da Gloria,1
2024,ESALQ,ANÁLISE MICROBIOLÓGICA DO LEITE DE PEQUENOS PRODUTORES,Cultura e Extensão,Luiz Lehmann Coutinho,2
2024,ESALQ,Anatomia Vegetal na rede social,Cultura e Extensão,Aline Oriani Maganhato,1
2024,ESALQ,APLICAÇÃO DO MODELO HYDRUS 1D NO TRANSPORTE DE ÁGUA E NUTRIENTES NO SOLO,Pesquisa,Jarbas Honorio de Miranda,1
2024,ESALQ,Apoio às atividades de pesquisa em políticas públicas e sistemas agroflorestais vinculadas ao Grupo TERRA,Pesquisa,Paulo Eduardo Moruzzi Marques,1
2024,ESALQ,Apoio no desenvolvimento de projetos de Ensino de eletrônica no contexto de aplicações agrícolas com kits Arduino,Ensino,Tiago Bueno de Moraes,1
2024,ESALQ,Apoio no desenvolvimento de projetos de Extensão de eletrônica no contexto de aplicações agrícolas com kits Arduino,Cultura e Extensão,Tiago Bueno de Moraes,1
2024,ESALQ,Aprimoramento em análises microbiológicas de água e alimentos por meio da extensão universitária,Cultura e Extensão,Daniele Fernanda Maffei,1
2024,ESALQ,APROXIMAÇÃO DOS FUTUROS  CIENTISTAS DE ALIMENTOS  À COMUNIDADE EXTERNA,Cultura e Extensão,Wanessa Melchert Mattos,1
2024,ESALQ,Articulação e Apoio para a Implementação do Plano Diretor Socioambiental Participativo do Campus  Luiz de Queiroz,Cultura e Extensão,Thiago Liborio Romanelli,1
2024,ESALQ,AS ÁRVORES E SUAS HISTÓRIAS: INTERPRETANDO O CLIMA E O MEIO AMBIENTE ATRAVÉS DOS ANÉIS DE CRESCIMENTO,Cultura e Extensão,Mario Tommasiello Filho,1
2024,ESALQ,"Atratividade de Dalbulus maidis (Delong & Wolcott, 1923) por variedades de milho resistente à Mollicutes",Pesquisa,Aline Sartori Guidolin,1
2024,ESALQ,Atributos reprodutivos de espécies arbóreas brasileiras de valor comercial,Pesquisa,Renato Augusto Ferreira de Lima,1
2024,ESALQ,AVALIAÇÃO DA PLASTICIDADE FENOTÍPICA EM UMA SÉRIE HISTÓRICA DE CULTIVARES DE SOJA POR MEIO DE ARRANJOS ESPACIAIS,Pesquisa,Renan Caldas Umburanas,1
2024,ESALQ,Avaliação da saúde do solo do Brasil via geotecnologias,Pesquisa,Jose Alexandre Melo Dematte,1
2024,ESALQ,Avaliação da saúde do solo em manguezais sobre pressões ambientais na região Amazônica,Pesquisa,Maurício Roberto Cherubin,1
2024,ESALQ,Avaliação das digestibilidades dos nutrientes e da energia do concentrado proteico de sorgo em suínos,Pesquisa,Urbano dos Santos Ruiz,1
2024,ESALQ,AVALIAÇÃO DAS PROPRIEDADES FÍSICAS E MECÂNICAS DE QUATRO ESPÉCIES DE MADEIRA DA AMAZÔNIA,Pesquisa,Geraldo Bortoletto Junior,1
2024,ESALQ,Avaliação de dados do sequenciamento de comunidades de bactérias de solo cultivado com cana-de-açúcar,Pesquisa,Fernando Dini Andreote,1
2024,ESALQ,Avaliação do vigor de sementes e a sua influência no desenvolvimento do sistema radicular de plantas de soja,Pesquisa,Francisco Guilhien Gomes Junior,1
2024,ESALQ,Avaliação em larga escala da taxa variável de fertilizantes em citros,Pesquisa,Andre Freitas Colaco,1
2024,ESALQ,Avaliando o efeito indireto de plantas transgênicas Bt sobre o desenvolvimento individual e crescimento populacional de parasitoides,Pesquisa,Lessando Moreira Gontijo,1
2024,ESALQ,"Balanço de energia, do carbono e do CO2 na produção de madeira roliça e serrada de florestas plantadas de eucaliptos em pequenas propriedades rurais.",Pesquisa,José Nivaldo Garcia,1
2024,ESALQ,"Biodiversidade e Conservação: divulgação científica do LMUSP e do NACE PTECA, ESALQ",Cultura e Extensão,Alexandre Reis Percequillo,1
2024,ESALQ,Bioinsumos na transição ecológica: Divulgação por meios sociais de comunicação,Cultura e Extensão,Italo Delalibera Junior,1
2024,ESALQ,BIOPRODUTOS DA FLORESTA E RECICLAGEM DE PAPEL,Cultura e Extensão,Humberto de Jesus Eufrade Junior,1
2024,ESALQ,Boletim de monitoramento agrícola a partir de índices de vegetação,Cultura e Extensão,Ana Claudia dos Santos Luciano Vicente,1
2024,ESALQ,Boletim Macroeconômico,Cultura e Extensão,Daniel Ferreira Caixe,1
2024,ESALQ,Botânica em ação: coleções didáticas que movimentam a educação nas escolas,Cultura e Extensão,Vinicius Castro Souza,1
2024,ESALQ,Brazilian Soil Health Partnership: um instrumento de disseminação do conhecimento em saúde do solo,Cultura e Extensão,Maurício Roberto Cherubin,1
2024,ESALQ,CAPACITAÇÃO DE EMPRESAS DE BASE TECNOLÓGICA NASCENTES NO AGRONEGÓCIO,Cultura e Extensão,Catarina Barbosa Careta,1
2024,ESALQ,Captar para Promover Dignidade: um convite às empresas para promoção da inclusão de mulheres em situação de violência,Cultura e Extensão,Heliani Berlato dos Santos,2
2024,ESALQ,Caracterização da estrutura do solo por meio de análises de imagens 2D,Pesquisa,Miguel Cooper,1
2024,ESALQ,Caracterização e avaliação agronômica de composto proveniente de macrófitas aquáticas   Fase 2,Pesquisa,Tiago Tezotto,1
2024,ESALQ,CARACTERIZAÇÃO FENOLÓGICA DAS DEZ PRINCIPAIS CULTIVARES DE AMENDOIM PLANTADAS NO ESTADO DE SÃO PAULO,Pesquisa,Carlos Armênio Khatounian,1
2024,ESALQ,CARACTERIZAÇÃO FÍSICA E QUÍMICA DE RESÍDUOS DA RECICLAGEM DE EMBALAGENS LONGA VIDA,Pesquisa,Humberto de Jesus Eufrade Junior,1
2024,ESALQ,"Casa do Bem Viver : co-construindo um Futuro Sustentável e Inclusivo com Agroecologia, Educação Ambiental e Permacultura",Inclusão e Pertencimento,Nathalia Cristina Costa do Nascimento,1
2024,ESALQ,Casa do Produtor Rural,Cultura e Extensão,Nelson Sidnei Massola Júnior,2
2024,ESALQ,Casa do Produtor Rural   SolidarESA Cultivo de Pimentão,Cultura e Extensão,Rafael Munhoz Pedroso,1
2024,ESALQ,CASA DO PRODUTOR RURAL: CARTILHA SOBRE CULTIVO DE PITAIA,Cultura e Extensão,Simone Rodrigues da Silva,1
2024,ESALQ,Ceres: Mulheres que semeiam vida na agricultura urbana,Cultura e Extensão,Ana Dionisia da Luz Coelho Novembre,2
