Edital,Unidade,Título,Vertente,Orientador,Total de Bolsa
2024,FORP,Incentivo à Cultura local - elaboração e edição da Agenda Cultural,Cultura e Extensão,Fernanda de Carvalho Panzeri,3
2024,FORP,Inclusão e Suporte à Estudantes Neurodivergentes na Faculdade de Odontologia de Ribeirão Preto da Universidade de São Paulo,Inclusão e Pertencimento,Lara Maria Alencar Ramos Innocentini,1
2024,FORP,INDUÇÃO DA DIFERENCIAÇÃO OSTEOBLÁSTICA EM ESFEROIDES DE CÉLULAS TRONCO DA POLPA DENTÁRIA HUMANA,Pesquisa,Geraldo Aleixo da Silva Passos Junior,1
2024,FORP,Interações de manchas de sangue em tecidos: diferenças morfológicas em uma análise macro e microscópica das superfícies,Pesquisa,Ricardo Henrique Alves da Silva,1
2024,FORP,LABORATÓRIO DE NEUROFISIOLOGIA MOLECULAR: DIVULGAÇÃO CIENTÍFICA E REDES SOCIAIS,Cultura e Extensão,Elaine Aparecida Del Bel Belluz Guimaraes,1
2024,FORP,Lesões teciduais decorrentes de próteses removíveis mal adaptadas e/ou fraturadas.,Pesquisa,Valéria Oliveira Pagnano de Souza,1
2024,FORP,MODERNIZAÇÃO E ENGAJAMENTO: ESTRATÉGIAS PARA OTIMIZAR A COMUNICAÇÃO DO PROGRAMA DE PÓS-GRADUAÇÃO EM ODONTOPEDIATRIA DA FORP-USP,Cultura e Extensão,Raquel Assed Bezerra da Silva,1
2024,FORP,"Monitoria na Disciplina de Ortodontia Preventiva, na FORP-USP
Orientação e instrução acadêmica",Ensino,Maria Bernadete Sasso Stuani,1
2024,FORP,O cuidado à População em Situação de Rua e a formação de profissionais da Atenção Primária,Cultura e Extensão,Luana Pinho de Mesquita Lago,1
2024,FORP,O desconhecido de Collegno : análise e elaboração de curta metragem sobre caso pericial histórico da Odontologia Legal,Cultura e Extensão,Ricardo Henrique Alves da Silva,1
2024,FORP,"O USO DA GRADE VERTICAL FIXA MODIFICADA E ESPORÕES LINGUAIS, NA CORREÇÃO DA MORDIDA ABERTA ANTERIOR DENTÁRIA",Pesquisa,Maria Bernadete Sasso Stuani,1
2024,FORP,Podcast como instrumento para educação em saúde,Ensino,Francisco Wanderley Garcia de Paula e Silva,1
2024,FORP,Precisão de escaneamentos intraorais e avaliação da técnica conduzida por diferentes operadores,Pesquisa,Regina Guenka Palma Dibb,1
2024,FORP,Produção de materiais didáticos para a área de Radiologia Odontológica e Imaginologia com recursos digitais e inteligência artificial,Ensino,Hugo Gaêta Araujo,1
2024,FORP,Produção de Material Didático para apoio a aulas de Graduação da FORP/USP,Ensino,Raquel Fernanda Gerlach,1
2024,FORP,Programa de Educação em Dor Orofacial Baseado em Mindfulness: Grupos Focais em Sala de Espera,Pesquisa,Laís Valencise Magri,1
2024,FORP,"Projeto: Relação das doenças periodontais e outras doenças crônicas não transmissíveis
SubProjeto:  Doença periodontal e obesidade",Pesquisa,Daniela Bazan Palioto Bulle,1
2024,FORP,Promoção de saúde para portadores de Prótese Parcial Removíve,Cultura e Extensão,Valéria Oliveira Pagnano de Souza,1
2024,FORP,Recursos Lúdicos-Educativos para o Cuidado em Saúde Bucal: Trilhando Caminhos de Comunicação com Crianças Imigrantes ou na condição de Refugiadas.,Cultura e Extensão,Kranya Victoria Díaz Serrano,3
2024,FORP,Redes Sociais como Plataformas de Apoio para Aprendizagem e Divulgação de Conhecimento,Ensino,Mario Taba Junior,1
2024,FORP,Relação entre densidade mineral óssea e índice de massa corporal: Avaliação radiomorfométrica e fractal em radiografias panorâmicas.,Pesquisa,Alan Grupioni Lourenço,1
2024,FORP,SAÚDE BUCAL NO PROGRAMA SAÚDE NA ESCOLA,Ensino,Luana Pinho de Mesquita Lago,1
2024,FORP,Serviço de Atendimento por meio de Terapias Complementares para indivíduos com Desordem Crânio-Dento-Facial,Cultura e Extensão,Rodrigo Galo,1
2024,FORP,Sorriso livre: Iniciativa para Promoção de Saúde Bucal em Usuários de Próteses Parciais Fixas.,Cultura e Extensão,Joel Ferreira Santiago Junior,1
2024,FORP,Tecnologia Social em Saúde Bucal: Divulgação de Conhecimentos sobre Disfunções Temporomandibulares e Dores Orofaciais nas Redes Sociais,Cultura e Extensão,Laís Valencise Magri,1
2024,FORP,Urgências em Odontopediatria,Cultura e Extensão,Alexandra Mussolino de Queiroz,2
2024,FORP,Uso de nanopartículas de resveratrol em cimento hidráulico para capeamento pulpar: avaliação das propriedades físico químicas,Pesquisa,Walter Raucci Neto,1
2024,FORP e FCFRP,Avaliação por microCT da eficácia de protocolos de irrigação final na remoção de debris dentinários de canais mesiais de molares inferiores com istmos,Pesquisa,Jardel Francisco Mazzi Chaves,1
2024,FSP,A comunicação científica em nutrição entre comunidades do Município de São Paulo visitadas no Projeto Pastoral da Criança-LANPOP-HNT,Cultura e Extensão,Wolney Lisbôa Conde,1
2024,FSP,A desigualdades sociais e de gênero em indicadores de nutrição e saúde entre adultos jovens no Brasil: a transição 2013-2019,Pesquisa,Wolney Lisbôa Conde,1
2024,FSP,A dupla carga de malnutrição e as novas perspectivas para o ensino da Avaliação Nutricional,Ensino,Wolney Lisbôa Conde,1
2024,FSP,Aceitabilidade de programa de mensagens eletrônicas para promoção de alimentação saudável em escolares de município Amazônico.,Pesquisa,Marly Augusto Cardoso,1
2024,FSP,Aedes aegypti na Comunidade da Faculdade de Saúde Pública e Centro de Saúde Paula Souza da USP: Ações para Ampliação de Conhecimento e Empoderamento,Cultura e Extensão,Francisco Chiaravalloti Neto,1
2024,FSP,Alimentação sustentável: engajamento social com uso de múltiplas plataformas,Cultura e Extensão,Aline Martins de Carvalho,1
2024,FSP,"ANÁLISE DOS CASOS DE GESTANTES COM COVID-19, SEGUNDO CARACTERÍSTICAS REGIONAIS NO ESTADO DE SÃO PAULO",Pesquisa,Zilda Pereira da Silva,1
2024,FSP,Análise espacial do tempo de diagnóstico e do tempo de tratamento de pacientes com câncer no estado de São Paulo.,Pesquisa,Francisco Chiaravalloti Neto,1
2024,FSP,Arboviroses urbanas: Informação como ferramenta de prevenção,Cultura e Extensão,Fredy Galvis Ovallos,1
2024,FSP,As Comunidades Terapêuticas e seus efeitos no cuidado às pessoas em uso de álcool e outras drogas,Pesquisa,Laura Camargo Macruz Feuerwerker,1
2024,FSP,"Associação entre insegurança alimentar, ingestão de alimentos e mortalidade em pacientes em hemodiálise",Pesquisa,Alisson Diego Machado,1
2024,FSP,Avaliação da presença de bactérias resistentes a antimicrobianos em amostras de esgotos domésticos,Pesquisa,Maria Tereza Pepe Razzolini,1
2024,FSP,"Centro de Memória da Faculdade de Saúde Pública e o
ensino virtual na formação em História da Saúde para a graduação.",Ensino,Maria Cristina da Costa Marques,2
2024,FSP,Construindo a transversalização de valores de inclusão e pertencimento na Faculdade de Saúde Pública da USP,Inclusão e Pertencimento,Bárbara Hatzlhoffer Lourenço,2
2024,FSP,Consumo excessivo de carne no Brasil: impacto na mortalidade e custos em saúde,Pesquisa,Aline Martins de Carvalho,1
2024,FSP,"Desafios e avanços no controle de perdas de água no contexto do Plano de Recursos Hídricos das Bacias dos Rios Piracicaba, Capivari e Jundiaí PCJ",Pesquisa,Tadeu Fabricio Malheiros,1
2024,FSP,Desenvolvimento de instrumento para avaliar a percepção dos consumidores em relação à informação sobre edulcorantes em rótulos de alimentos.,Pesquisa,Ana Paula Bortoletto Martins,1
2024,FSP,Desigualdades no uso e acesso aos serviços de saúde: análises dos sistemas de informações da produção de serviços do SUS em oncologia,Pesquisa,Marilia Cristina Prado Louvison,1
2024,FSP,Determinação dos Hidrocarbonetos Policíclicos Aromáticos (HPAs) no material particulado atmosférico e do risco para a saúde pública,Pesquisa,Thiago Nogueira,1
2024,FSP,Divulgação científica no projeto de ciência cidadã de monitoramento da qualidade do ar em São Paulo,Cultura e Extensão,Thiago Nogueira,1
2024,FSP,Evasão escolar e vulnerabilidade em estudantes dos cursos da Faculdade de Saúde Pública da USP.,Inclusão e Pertencimento,Tatiana Natasha Toporcov,2
2024,FSP,"Formação para gestores públicos e atores sociais em segurança alimentar e nutricional, sistemas alimentares sustentáveis e sindemia global",Cultura e Extensão,Dirce Maria Lobo Marchioni,1
2024,FSP,Fortalecendo o protagonismo estudantil na produção de dinâmicas mais acolhedoras e criativas em espaços coletivos de convivência na FSP,Inclusão e Pertencimento,Laura Camargo Macruz Feuerwerker,2
2024,FSP,Gestão e curadoria de dados para assegurar a qualidade em pesquisa:  estudo epidemiológico do Instituto Nacional de Ciência e Tecnologia Expossoma,Pesquisa,Dirce Maria Lobo Marchioni,1
2024,FSP,"Insegurança Alimentar e Nutricional de estudantes da USP no período pós pandêmico e sua relação com raça/cor, gênero e renda",Inclusão e Pertencimento,Dirce Maria Lobo Marchioni,1
2024,FSP,Jornada Universitária da Saúde: curadoria de documentos digitais para a preservação da memória,Cultura e Extensão,Carinne Magnago,1
2024,FSP,JORNADAS DE SAÚDE SEXUAL E REPRODUTIVA NA VILA BRASILÂNDIA,Cultura e Extensão,Diego Madi Dias,1
2024,FSP,Levantamento de Dados das Substâncias Bioativas Ligadas à Saúde Mental,Pesquisa,Elizabeth Aparecida Ferraz da Silva Torres,1
2024,FSP,Memórias de Luta: escutando e difundindo histórias de vida de lideranças idosas,Cultura e Extensão,Rodrigo Cardoso Bonicenha,1
2024,FSP,Mídias digitais como estratégia de comunicação científica sobre alimentação saudável e sustentável em tempos de sindemia global,Cultura e Extensão,Alisson Diego Machado,1
2024,FSP,Mudanças climáticas e saúde: Política de Atenção Básica em foco,Pesquisa,Carinne Magnago,1
2024,FSP,MULTIPLICADORES/AS PARA A PROMOÇÃO DA SAÚDE E DOS DIREITOS SEXUAIS E REPRODUTIVOS E COMBATE À DISCRIMINAÇÃO: INTERVENÇÕES CULTURAIS EM REDES SOCIAIS,Cultura e Extensão,Cristiane da Silva Cabral,1
2024,FSP,O cultivo do corpo no Mundo da Rua: experiência de adversidade e vínculo entre mulheres/lactantes e crianças de até 5 anos em São Paulo,Pesquisa,Diego Madi Dias,1
2024,FSP,Oficinas Culinárias e o Direito à Cidade: Promoção de estratégias de Segurança Alimentar e Nutricional no território com abordagem participativa,Pesquisa,Claudia Maria Bógus,1
2024,FSP,Práticas de saudabilidade e sustentabilidade envolvendo o CRUSP: modificações no ambiente alimentar.,Inclusão e Pertencimento,Aline Rissatto Teixeira,2
2024,FSP,Práticas de Treinamento Didático Pedagógica com Ênfase nas Metodologias Ativas de Ensino à Distância ou Presencial de disciplinas da graduação,Ensino,Elizabeth Aparecida Ferraz da Silva Torres,1
2024,FSP,"Projeto Horta da FSP: laboratório didático vivo sobre sistemas alimentares sustentáveis e educação alimentar, nutricional e ambiental",Cultura e Extensão,Claudia Maria Bógus,1
2024,FSP,Quedas em Idosos da Unidade de Referência à Saúde do Idoso Gerado de Paula Souza,Pesquisa,Helena Akemi Wada Watanabe,1
2024,FSP,"RELAÇÕES DE DEFINIÇÃO E DECISÃO DE RISCO EM SAÚDE NO CONTEXTO DA SOCIEDADE CONTEMPORÂNEA:
UMA MIRADA À QUESTÃO DA SAÚDE E CIDADANIA",Pesquisa,Aurea Maria Zöllner Ianni,1
2024,FSP,"Resiliência, vulnerabilidade e capacidade adaptativa de migrantes venezuelanos às mudanças climáticas em São Paulo, Brasil",Pesquisa,Leandro Luiz Giatti,1
2024,FSP,REVISÃO DE ESCOPO DE ESTRATÉGIAS PARA A REDUÇÃO DE BARREIRAS E FACILITADORES DO DIAGNÓSTICO OPORTUNO DO CÂNCER DE BOCA,Pesquisa,Tatiana Natasha Toporcov,1
2024,FSP,Revisão do curso de extensão  Narrativas de Peso: o estigma relacionado ao peso corporal e o cuidado em saúde,Inclusão e Pertencimento,Fernanda Baeza Scagliusi,2
2024,FSP,Saúde Coletiva e História: intersecções e debates no ensino da formação em saúde.,Pesquisa,Maria Cristina da Costa Marques,1
2024,FSP,Sistema de vigilância da fluoretação da água de abastecimento: um portal de disseminação de informações de interesse público,Cultura e Extensão,Paulo Frazão São Pedro,1
2024,FSP,Solidão e Isolamento Social: criando e reforçando laços comunitários na Faculdade de Saúde Pública,Inclusão e Pertencimento,Rodrigo Cardoso Bonicenha,1
2024,FSP,Solidão e Isolamento Social: mapeando atividades socioeducativas para o atendimento de pessoas idosas,Pesquisa,Rodrigo Cardoso Bonicenha,1
2024,FSP,"Sou aluno do Curso de Bacharelado de Saúde Pública da FSP-USP:
chegada, vivências e desafios",Inclusão e Pertencimento,Maria Cristina da Costa Marques,1
2024,FSP,"Teatro, saúde, corporeidades e modos de estar no mundo",Cultura e Extensão,Laura Camargo Macruz Feuerwerker,1
2024,FSP,"Território e intersetorialidade: cartografias das redes e arranjos de governança na proteção social em Perus, São Paulo.",Cultura e Extensão,Leandro Luiz Giatti,1
2024,FSP e FCF,Ingestão energética reportada e necessidades energéticas estimadas por equações preditivas em adolescentes e adultos de São Paulo,Pesquisa,Regina Mara Fisberg,1
2024,FSP e FCF,Monitoramento e Controle do mosquito Aedes aegypti na Faculdade de Saúde Pública da USP,Cultura e Extensão,Tamara Nunes de Lima Camara,1
2024,FZEA,. Visita Monitorada na FZEA USP,Cultura e Extensão,Eliana Setsuko Kamimura,2
2024,FZEA,A contaminação aquática por metais e agrotóxicos: uma análise dos efeitos em peixes em uma paisagem quimicamente heterogênea,Pesquisa,Raquel Aparecida Moreira,1
2024,FZEA,A Equideocultura como ferramenta de desenvolvimento emocional,Ensino,Roberta Ariboni Brandi,1
2024,FZEA,A Medicina Veterinária na educação em saúde.,Cultura e Extensão,Vera Letticie de Azevedo Ruiz,2
2024,FZEA,"Ácido Guanidinoacético e seu Papel no Desempenho, Qualidade da Carcaça e Perfil Metabolômico de Bovinos Nelore",Pesquisa,Saulo da Luz e Silva,1
2024,FZEA,Ações de conscientização da comunidade acadêmica sobre o Transtorno do Espectro Autista e direcionamentos para inclusão do portador de TEA na FZEA/USP,Inclusão e Pertencimento,Samantha Cristina de Pinho,1
2024,FZEA,Adaptação e testes de algoritmos de otimização para elaboração de dietas caseiras para cães e gatos,Pesquisa,Daniel Emygdio de Faria Filho,1
2024,FZEA,ANÁLISE DE VITAMINA C EM DIFERENTES SUCOS EM PÓ,Pesquisa,Mônica Roberta Mazalli Medina,1
2024,FZEA,Aperfeiçoamento de um sistema de aquisição de dados e controle para manejo zootécnico meio de IoT.,Pesquisa,Rubens André Tabile,1
2024,FZEA,Aplicação de compostos bioativos de canihua (Chenopodium pallidicaule) em hambúrguer e salchicha,Pesquisa,Marco Antonio Trindade,1
2024,FZEA,Apoio à Permanência e Continuidade do discente com dificuldades econômicas e de relacionamento na FZEA com origami e kirigami.,Inclusão e Pertencimento,Jorge Lizardo Diaz Calle,2
2024,FZEA,Aprendendo sobre Biossistemas com o Sistema Orgânico de Produção de Hortaliças,Ensino,Fabricio Rossi,2
2024,FZEA,Aquisição e alimentação domiciliar de pescados:  oferta de produtos da piscicultura e preferências de consumidores,Pesquisa,Marcelo Machado de Luca de Oliveira Ribeiro,1
2024,FZEA,"Aspectos genéticos de características de temperamento, produtivas e reprodutivas em bovinos Nelore Lemgruber",Pesquisa,Rachel Santos Bueno Carvalho,1
2024,FZEA,Assistência Técnica Veterinária ao Pequeno Produtor Rural da Região de Pirassununga,Cultura e Extensão,Eduardo Harry Birgel Junior,2
2024,FZEA,ASSOCIAÇÃO ALÉLICA E ENRIQUECIMENTO FUNCIONAL NA FASE INICIAL DE GANHO DE PESO DE BOVINOS DA RAÇA NELORE EM REGIME DE SECA,Pesquisa,José Bento Sterman Ferraz,1
2024,FZEA,"Atividades assistidas com cavalos: Definindo, aplicando e difundindo o conhecimento",Cultura e Extensão,Roberta Ariboni Brandi,1
2024,FZEA,Avaliação da eficiência de sistema planta-solo-microrganismo para geração de eletricidade.,Pesquisa,Ernane José Xavier Costa,1
2024,FZEA,Avaliação de diferentes fontes de óxido de zinco e dosagens sobre o desempenho e integridade intestinal de leitões em período de creche,Pesquisa,Carlos Alexandre Granghelli,1
2024,FZEA,AVALIAÇÃO DE MICROCLIMA NO BEM ESTAR ANIMAL EM DIFERENTES CONDIÇÕES DE INSTALAÇÕES DO TIPO FREE-STALL,Pesquisa,Arlindo Saran Netto,1
2024,FZEA,Avaliação do uso de probiótico e prebiótico para frangos de corte e poedeiras comerciais,Pesquisa,Douglas Emygdio de Faria,1
2024,FZEA,Avaliação dos módulos de gamificação inseridos no ambiente virtual com a estratégia Blended Learning da disciplina ZAB0161,Ensino,Jorge Lizardo Diaz Calle,1
2024,FZEA,"Avaliação sanitária no gatil municipal de Pirassununga, SP",Cultura e Extensão,Lara Borges Keid,1
2024,FZEA,Avaliação sensorial e de vida de prateleira de hidromel potencialmente probiótico a partir da co-fermentação de kombucha e S. boulardii,Pesquisa,Eliana Setsuko Kamimura,1
2024,FZEA,Banco de Dados em Eletrocardiografia Veterinária,Ensino,Deise Carla Almeida Leite Dellova,2
2024,FZEA,Beer Game: Continuando a Experiência Inovadora na Formação em Engenharia de Alimentos da FZEA/USP,Ensino,Vivian Lara dos Santos Silva Rossignolo,1
2024,FZEA,"Biocarvão de borra de café com ativadores alternativos: obtenção, caracterização e testes de eficiência de adsorção de poluentes emergentes em água",Pesquisa,Fernando Gustavo Tonin,1
2024,FZEA,"Bloqueio da meiose em oócitos bovinos: eficiência, reversibilidade e consequências à cinética da maturação e desenvolvimento embrionário posterior",Pesquisa,Claudia Lima Verde Leal,1
2024,FZEA,Caldo de cana com camu-camu: processamento e vida de prateleira,Pesquisa,Rodrigo Rodrigues Petrus,1
2024,FZEA,Caracterização da porosidade de alimentos crocantes via análise de imagem e classificação por redes neurais artificiais,Pesquisa,Gustavo Cesar Dacanal,1
2024,FZEA,Ciência cidadã como ferramenta de extensão para promover a conservação da fauna silvestre do Campus Fernando Costa.,Cultura e Extensão,Caio Filipe da Motta Lima,1
2024,FZEA,CINÉTICA DE INATIVAÇÃO TÉRMICA DA POLIFENOLOXIDASE E DA PEROXIDASE E DA DEGRADAÇÃO DA ATIVIDADE ANTIOXIDANTE DA POLPA DE JUÇARA (Euterpe edulis Mart.),Pesquisa,Cynthia Ditchfield,1
2024,FZEA,"Como o nitrogênio afeta a ontogênese do colmo da cana-de-açúcar?
Estudos anatômicos integrados à inteligência artificial.",Pesquisa,João Paulo Rodrigues Marques,1
2024,FZEA,"COMSCIÊNCIA - DESENVOLVENDO A CONSCIÊNCIA SOCIAL, ECONÔMICA, AMBIENTAL E CIENTÍFICA",Cultura e Extensão,Cynthia Ditchfield,1
2024,FZEA,Construção de um dashboard para acompanhamento dos cursos de graduação da FZEA/USP,Pesquisa,Giovana Fumes Ghantous,1
2024,FZEA,CRIAÇÃO DE FICHA PROTOCOLAR PARA AVALIAÇÃO FUNCIONAL QUALITATIVA DE SUÍNOS NO PÓS OPERATÓRIO DA CIRURGIA DE AUTOTRANSPLANTE ANORRETAL,Pesquisa,Silvio Henrique de Freitas,1
2024,FZEA,DA CIÊNCIA PARA O CAMPO,Cultura e Extensão,Arlindo Saran Netto,1
2024,FZEA,De... Para... Cartas pessoais De estudantes da USP Para estudantes de escolas de ensino fundamental e médio do município de Pirassununga,Cultura e Extensão,Juliano Fiorelli,1
2024,FZEA,Definindo o perfil morfométrico dos cavalos destinados à terapias assistidas com cavalos,Pesquisa,Roberta Ariboni Brandi,1
2024,FZEA,"Desempenho, carcaça e qualidade de carcaça e carne de progênies provenientes de touros contrastantes da raça para gordura e área de olho de lombo",Pesquisa,Angélica Simone Cravo Pereira,1
2024,FZEA,Desenvolver o projeto 3D de um equipamento da área de engenharia utilizando o software Inventor da Autodesk,Ensino,Caio Eduardo de Campos Tambelli,1
2024,FZEA,"DESENVOLVIMENTO  DE SENSORES WIRELESS (SEM FIO) COM TECNOLOGIA IoT  (INTERNET DAS COISAS) 
PARA AVALIAÇÃO DE PULVERIZAÇÃO EM AGRICULTURA",Pesquisa,Clovis Fischer,1
2024,FZEA,Desenvolvimento de alimentador microcontrolado e monitoramento da qualidade da água para lambaris (Astyanax altiparanae) cultivados em laboratório.,Ensino,Adriano Rogerio Bruno Tech,1
2024,FZEA,Desenvolvimento de atividades didáticas para auxiliar a aprendizagem nas disciplinas de Histologia oferecidas na FZEA,Ensino,Claudia Lima Verde Leal,1
2024,FZEA,Desenvolvimento de géis proteicos mistos enriquecidos com vitaminas D3 e B2,Pesquisa,Samantha Cristina de Pinho,1
2024,FZEA,"Desenvolvimento de material didático para ensino de Botânica na FZEA, USP.",Ensino,João Paulo Rodrigues Marques,1
2024,FZEA,Desenvolvimento de material didático para uso na disciplina de Nutrição e Alimentação de Cães e Gatos,Ensino,Daniel Emygdio de Faria Filho,1
2024,FZEA,Desenvolvimento de pastas de fosfatos de cálcio como tinta para impressão 3D em impressora comercial adaptada para processo de extrusão,Pesquisa,Eliana Cristina da Silva Rigo,1
2024,FZEA,DESENVOLVIMENTO DE PROTÓTIPOS DE EQUIPAMENTOS SOLARES PARA UTILIZAÇÃO EM AULAS PRÁTICAS DA GRADUAÇÃO,Ensino,Celso Eduardo Lins de Oliveira,1
2024,FZEA,Desenvolvimento de Site e Vídeos sobre Formulação de Ração   Promovendo o Conhecimento e Educação Continuada,Cultura e Extensão,Daniel Emygdio de Faria Filho,1
2024,FZEA,Desenvolvimento de software para ficha anestésica veterinária digital,Pesquisa,Adriano Bonfim Carregaro,1
2024,FZEA,Desenvolvimento de um livro didático voltado para a realização das atividades de curricularização para a disciplina ZEB 0761,Ensino,Luis Fernando Soares Zuin,1
2024,FZEA,Desenvolvimento de um sistema de monitoramento de comportamento animal usando inteligência artificial e visão computacional.,Pesquisa,Adriano Rogerio Bruno Tech,1
2024,FZEA,DESENVOLVIMENTO E APLICAÇÃO DE ATLAS DIGITAIS RADIOGRÁFICO E ULTRASSONOGRÁFICO EM DIAGNÓSTICO POR IMAGEM VETERINÁRIA,Cultura e Extensão,Marcus Antônio Rossi Feliciano,1
2024,FZEA,Desenvolvimento e caracterização de bala de goma de k-carragena com cálcio e compostos bioativos do extrato de própolis,Pesquisa,Izabel Cristina Freitas Moraes,1
2024,FZEA,Desmistificando as substâncias químicas presentes em nossa dieta,Cultura e Extensão,Carmen Silvia Favaro Trindade,1
2024,FZEA,DesRotulando: educar para melhor alimentar e nutrir,Cultura e Extensão,Fernanda Maria Vanin,1
2024,FZEA,Detecção de espécies microbianas patogênicas em cama de frango tratada com aditivo acidificante utilizando métodos moleculares,Pesquisa,Ricardo Luiz Moro de Sousa,1
2024,FZEA,"Diagnóstico das hemoparasitoses erliquiose, anaplasmose e babesiose, em cães no município de Pirassununga   SP e região",Pesquisa,Heidge Fukumasu,1
2024,FZEA,Diálogos sobre Sustentabilidade e Inclusão: Levantamento e Diagnóstico Dentro e Fora da Comunidade Universitária da USP,Inclusão e Pertencimento,Maria Teresa de Alvarenga Freire,1
2024,FZEA,Diferentes ganhos de peso de bovinos Nelore na recria e seus impactos sobre o metaboloma da carne,Pesquisa,Miguel Henrique de Almeida Santana,1
2024,FZEA,Divulgação científica dos canais comunicativos da  Rede Aurora de Diálogos em Ater Digital  e do  Grupo de Estudos e Pesquisa Horizonte Rural,Cultura e Extensão,Luis Fernando Soares Zuin,1
2024,FZEA,DIVULGAÇÃO E DESENVOLVIMENTO DE INFORMAÇÃO SOBRE A PLANTA SOLAR DA FZEA,Cultura e Extensão,Celso Eduardo Lins de Oliveira,1
2024,FZEA,Divulgação e organização de eventos de internacionalização e de pós-graduação na FZEA/USP,Cultura e Extensão,Milena Martelli Tosi,1
2024,FZEA,"Divulgação em redes sociais (Facebook , Instagram  e YouTube ) de trabalhos e eventos científicos desenvolvidos na FZEA   FZEA na Rede",Cultura e Extensão,Ana Carolina de Sousa Silva,1
2024,FZEA,Divulgando o curso de Engenharia de Alimentos FZEA/USP nas redes sociais,Cultura e Extensão,Izabel Cristina Freitas Moraes,1
2024,FZEA,Educação e cidadania: Resíduos sólidos urbanos e práticas sustentáveis,Cultura e Extensão,Maria Teresa de Alvarenga Freire,1
2024,FZEA,Efeito da adição de ácido cítrico e ácido lático em filmes a base de gelatina   Formação de filmes poliméricos e mobilidade protônica.,Pesquisa,Sergio Paulo Amaral Souto,1
2024,FZEA,Efeito de níveis crescentes de extrato de tanino sobre a emissão de metano em bovinos Nelore confinados,Pesquisa,Ives Cláudio da Silva Bueno,1
2024,FZEA,Efeito do Processamento na Bioacessibilidade Proteica e Citotoxicidade de farinhas de Pupunha (Bactris gasipaes): um estudo preditivo,Pesquisa,Fernanda Maria Vanin,1
2024,FZEA,Egresso do Curso de Zootecnia: atualização da informação e novas formas de comunicação,Ensino,Sarita Bonagurio Gallo,1
2024,FZEA,Elaboração de materiais didáticos sobre a ANÁLISE DE DADOS DE EXPERIMENTOS COM MEDIDAS REPETIDAS UTILIZANDO O SAS E O R,Ensino,Cesar Goncalves de Lima,1
2024,FZEA,ELABORAÇÃO DE MATERIAL DIÁTICO SUPLEMENTAR DE FUNDAMENTOS DE ENGENHARIA DE ALIMENTOS,Ensino,Juliane Viganó,1
2024,FZEA,Elaboração de recursos educativos inovadores para o ensino de nutrigenômica animal utilizando abordagens metodológicas diversificadas,Ensino,Miguel Henrique de Almeida Santana,1
2024,FZEA,"EMPODERA: desenvolvendo o empreendedorismo e o empoderamento de mulheres jovens, adultas e da terceira idade",Cultura e Extensão,Marta Mitsui Kushida,2
2024,FZEA,EMPODERAMENTO FEMININO NO AMBIENTE UNIVERSITÁRIO,Inclusão e Pertencimento,Tamara Maria Gomes Aprilanti,2
2024,FZEA,EMPREGO DE SIMULADORES BASEADOS EM SOFTWARES LIVRES NO ENSINO DE ENGENHARIA DE ALIMENTOS,Ensino,Rogers Ribeiro,1
2024,FZEA,ENGENHARIA ECONÔMICA APLICADA: DESENVOLVIMENTO DE MATERIAL DIDÁTICO PARA ENGENHARIA DE ALIMENTOS E ENGENHARIA DE BIOSSISTEMAS,Ensino,Fernando Vinicius da Rocha,2
2024,FZEA,Ensaio Clínico de Fase 1: Determinação da Toxicidade Limitante da Dose e Dose Máxima Tolerada de Vírus de New Castle em Equinos Sadios.,Pesquisa,Renata Gebara Sampaio Dória,1
2024,FZEA,Estabelecimento de intervalos de referência hematológicos e de bioquímica sérica de jaritatacas (Conepatus amazonicus),Pesquisa,Caio Filipe da Motta Lima,1
